<?xml version="1.0" encoding="UTF-8"?>
<!--The contents of this file are subject to the terms
of the Common Development and Distribution License
(the "License").  You may not use this file except
in compliance with the License.

You can obtain a copy of the license at
http://www.opensource.org/licenses/cddl1.php
See the License for the specific language governing
permissions and limitations under the License.--><xs:schema targetNamespace="urn:yahoo:yn" elementFormDefault="qualified" xmlns:xs="http://www.w3.org/2001/XMLSchema" xmlns="urn:yahoo:yn">
  <xs:element name="ResultSet">
    <xs:complexType>
      <xs:sequence>
        <xs:element name="Result" type="ResultType" minOccurs="0" maxOccurs="50"/>
      </xs:sequence>
      <xs:attribute name="totalResultsAvailable" type="xs:integer"/>
      <xs:attribute name="totalResultsReturned" type="xs:integer"/>
      <xs:attribute name="firstResultPosition" type="xs:integer"/>
    </xs:complexType>
  </xs:element>
  <xs:complexType name="ResultType">
    <xs:sequence>
      <xs:element name="Title" type="xs:string"/>
      <xs:element name="Summary" type="xs:string"/>
      <xs:element name="Url" type="xs:string"/>
      <xs:element name="ClickUrl" type="xs:string"/>
      <xs:element name="NewsSource" type="xs:string"/>
      <xs:element name="NewsSourceUrl" type="xs:string"/>
      <xs:element name="Language" type="xs:string"/>
      <xs:element name="PublishDate" type="xs:string"/>
      <xs:element name="ModificationDate" type="xs:string" minOccurs="0"/>
      <xs:element name="Thumbnail" type="ImageType" minOccurs="0"/>
    </xs:sequence>
  </xs:complexType>
  <xs:complexType name="ImageType">
    <xs:sequence>
      <xs:element name="Url" type="xs:string"/>
      <xs:element name="Height" type="xs:integer" minOccurs="0"/>
      <xs:element name="Width" type="xs:integer" minOccurs="0"/>
    </xs:sequence>
  </xs:complexType>
</xs:schema><!--ws02.search.re2.yahoo.com compressed/chunked Tue Oct 18 13:12:21 PDT 2005-->